{
  "payload_version": "1.0",
  "task": "combined",
  "n": 24,
  "labels": [
    1,
    3,
    1,
    2,
    0,
    3,
    1,
    1,
    2,
    1,
    3,
    2,
    2,
    0,
    0,
    1,
    3,
    3,
    2,
    2,
    1,
    0,
    0,
    1
  ],
  "q_star": [
    [
      3,
      4,
      7,
      8,
      9,
      10,
      12,
      13,
      15,
      19,
      21,
      23
    ],
    [
      0,
      1,
      2,
      5,
      6,
      11,
      14,
      16,
      17,
      18,
      20,
      22
    ]
  ],
  "rival_partitions": {
    "one_block": [
      [
        0,
        1,
        2,
        3,
        4,
        5,
        6,
        7,
        8,
        9,
        10,
        11,
        12,
        13,
        14,
        15,
        16,
        17,
        18,
        19,
        20,
        21,
        22,
        23
      ]
    ],
    "singleton": [
      [
        0
      ],
      [
        1
      ],
      [
        2
      ],
      [
        3
      ],
      [
        4
      ],
      [
        5
      ],
      [
        6
      ],
      [
        7
      ],
      [
        8
      ],
      [
        9
      ],
      [
        10
      ],
      [
        11
      ],
      [
        12
      ],
      [
        13
      ],
      [
        14
      ],
      [
        15
      ],
      [
        16
      ],
      [
        17
      ],
      [
        18
      ],
      [
        19
      ],
      [
        20
      ],
      [
        21
      ],
      [
        22
      ],
      [
        23
      ]
    ],
    "spectral": [
      [
        3,
        4,
        7,
        8,
        9,
        10,
        12,
        13,
        15,
        19,
        21,
        23
      ],
      [
        0,
        1,
        2,
        5,
        6,
        11,
        14,
        16,
        17,
        18,
        20,
        22
      ]
    ],
    "louvain": [
      [
        1,
        2,
        5,
        6,
        7,
        9,
        12,
        14,
        16,
        17,
        18,
        20
      ],
      [
        0,
        3,
        4,
        8,
        10,
        11,
        13,
        15,
        19,
        21,
        22,
        23
      ]
    ]
  },
  "n_bootstrap": 30,
  "n_perm": 30,
  "seed": 42
}